{
    "$schema": "../../schedule-schema.json",
    "name": "Schedule",
    "main thread": "Main thread",
    "repeat": false,
    "threads": [
        {
            "name": "Main thread",
            "description": "Main thread",
            "tasks": [
                {
                    "task": "Animation"
                },
                {
                    "task": ""
                }
            ]
        },
        {
            "name": "Render thread",
            "description": "Render thread",
            "tasks": [
                {
                    "task": "Render"
                }
            ]
        },
        {
            "name": "Worker 1",
            "description": "",
            "tasks": [
                {
                    "task": "Animation"
                },
                {
                    "task" : "AA"
                }
            ]
        }
    ]
    
}