{
    "name"         : "Game loop schedule",
    "threads"      : [
        {
            "name"        : "Render Thread",
            "description" : "Draws frame N-1",
            "tasks"       : [
                {
                    "task" : "Render"
                }
            ]
        },
        {
            "name"        : "Main Thread",
            "description" : "Game loop",
            "tasks"       : [
                {
                    "task"        : "Input",
                    "wait thread" : "Render Thread",
                    "wait task"   : "Render"
                },
                {
                    "task" : "UI"
                },
                {
                    "task"        : "AI",
                    "wait thread" : "Worker 2",
                    "wait task"   : "Pre AI"
                },
                {
                    "task" : "User Code"
                },
                {
                    "task" : "Resolve Collisions"
                },
                {
                    "task" : "Update Forces"
                },
                {
                    "task" : "Move Objects"
                },
                {
                    "task" : "Copy State"
                }
            ]
        },
        {
            "name"        : "Worker 1",
            "description" : "Audio and physics",
            "tasks"       : [
                {
                    "task"        : "Audio"
                },
                {
                    "task"        : "Resolve Collisions",
                    "wait thread" : "Main Thread",
                    "wait task"   : "User Code"
                },
                {
                    "task"        : "Update Forces"
                },
                {
                    "task"        : "Move Objects"
                }
            ]
        },
        {
            "name"        : "Worker 2",
            "description" : "Pre AI and physics",
            "tasks"       : [
                {
                    "task"        : "Pre AI"
                },
                {
                    "task"        : "Resolve Collisions",
                    "wait thread" : "Main Thread",
                    "wait task"   : "User Code"
                },
                {
                    "task"        : "Update Forces"
                },
                {
                    "task"        : "Move Objects"
                }
            ]
        },
        {
            "name"        : "Worker 3",
            "description" : "Server input and physics",
            "tasks"       : [
                {
                    "task"        : "Resolve Collisions",
                    "wait thread" : "Main Thread",
                    "wait task"   : "User Code"
                },
                {
                    "task"        : "Animation"
                },
                {
                    "task"        : "Move Objects"
                }
            ]
        },
        {
            "name"        : "Worker 4",
            "description" : "Server output and physics",
            "tasks"       : [
                {
                    "task"        : "Resolve Collisions",
                    "wait thread" : "Main Thread",
                    "wait task"   : "User Code"
                },
                {
                    "task"        : "Animation"
                },
                {
                    "task"        : "Move Objects"
                }
            ]
        }
    ],
    "main thread"  : "Main Thread",
    "repeat"       : true
}